Image,MovieTitle,Year,Genre,Overview,Director,Star1,Star2,Star3,,
"https://m.media-amazon.com/images/M/MV5BYWY3N2EyOWYtNDVhZi00MWRkLTg2OTUtODNkNDQ5ZTIwMGJkXkEyXkFqcGdeQXVyMTMxODk2OTU@._V1_UX67_CR0,0,67,98_AL_.jpg",Crimes and Misdemeanors,1989,"Comedy, Drama",An ophthalmologist's mistress threatens to reveal their affair to his wife while a married documentary filmmaker is infatuated with another woman.,Woody Allen,Martin Landau,Woody Allen,Bill Bernstein,,
"https://m.media-amazon.com/images/M/MV5BYTVjYWJmMWQtYWU4Ni00MWY3LWI2YmMtNTI5MDE0MWVmMmEzL2ltYWdlXkEyXkFqcGdeQXVyMTQxNzMzNDI@._V1_UX67_CR0,0,67,98_AL_.jpg",The Untouchables,1987,"Crime, Drama, Thriller","During the era of Prohibition in the United States, Federal Agent Eliot Ness sets out to stop ruthless Chicago gangster Al Capone and, because of rampant corruption, assembles a small, hand-picked team to help him.",Brian De Palma,Kevin Costner,Sean Connery,Robert De Niro,,
"https://m.media-amazon.com/images/M/MV5BMWZiNWUwYjMtM2Y1Yi00MTZmLWEwYzctNjVmYWM0OTFlZDFhXkEyXkFqcGdeQXVyMTMxODk2OTU@._V1_UX67_CR0,0,67,98_AL_.jpg",Hannah and Her Sisters,1986,"Comedy, Drama","Between two Thanksgivings two years apart, Hannah's husband falls in love with her sister Lee, while her hypochondriac ex-husband rekindles his relationship with her sister Holly.",Woody Allen,Mia Farrow,Dianne Wiest,Michael Caine,,
"https://m.media-amazon.com/images/M/MV5BMzIwM2IwYTItYmM4Zi00OWMzLTkwNjAtYWRmYWNmY2RhMDk0XkEyXkFqcGdeQXVyNjU0OTQ0OTY@._V1_UX67_CR0,0,67,98_AL_.jpg",Brazil,1985,"Drama, Sci-Fi",A bureaucrat in a dystopic society becomes an enemy of the state as he pursues the woman of his dreams.,Terry Gilliam,Jonathan Pryce,Kim Greist,Robert De Niro,,
"https://m.media-amazon.com/images/M/MV5BMTQ2MTIzMzg5Nl5BMl5BanBnXkFtZTgwOTc5NDI1MDE@._V1_UX67_CR0,0,67,98_AL_.jpg",This Is Spinal Tap,1984,"Comedy, Music","Spinal Tap, one of England's loudest bands, is chronicled by film director Marty DiBergi on what proves to be a fateful tour.",Rob Reiner,Rob Reiner,Michael McKean,Christopher Guest,,
"https://m.media-amazon.com/images/M/MV5BOWMyNjE0MzEtMzVjNy00NjIxLTg0ZjMtMWJhNGI1YmVjYTczL2ltYWdlXkEyXkFqcGdeQXVyNzc5MjA3OA@@._V1_UX67_CR0,0,67,98_AL_.jpg",A Christmas Story,1983,"Comedy, Family","In the 1940s, a young boy named Ralphie attempts to convince his parents, his teacher and Santa that a Red Ryder BB gun really is the perfect Christmas gift.",Bob Clark,Peter Billingsley,Melinda Dillon,Darren McGavin,,
"https://m.media-amazon.com/images/M/MV5BYTdlMDExOGUtN2I3MS00MjY5LWE1NTAtYzc3MzIxN2M3OWY1XkEyXkFqcGdeQXVyNzkwMjQ5NzM@._V1_UX67_CR0,0,67,98_AL_.jpg",The Blues Brothers,1980,"Action, Adventure, Comedy","Jake Blues, just released from prison, puts together his old band to save the Catholic home where he and his brother Elwood were raised.",John Landis,John Belushi,Dan Aykroyd,Cab Calloway,,
"https://m.media-amazon.com/images/M/MV5BMzdmY2I3MmEtOGFiZi00MTg1LWIxY2QtNWUwM2NmNWNlY2U5XkEyXkFqcGdeQXVyNDk3NzU2MTQ@._V1_UX67_CR0,0,67,98_AL_.jpg",Manhattan,1979,"Comedy, Drama, Romance",The life of a divorced television writer dating a teenage girl is further complicated when he falls in love with his best friend's mistress.,Woody Allen,Woody Allen,Diane Keaton,Mariel Hemingway,,
"https://m.media-amazon.com/images/M/MV5BZWE4N2JkNDUtZDU4MC00ZjNhLTlkMjYtOTNkMjZhMDAwMDMyXkEyXkFqcGdeQXVyMTA0MjU0Ng@@._V1_UX67_CR0,0,67,98_AL_.jpg",All That Jazz,1979,"Drama, Music, Musical","Director/choreographer Bob Fosse tells his own life story as he details the sordid career of Joe Gideon, a womanizing, drug-using dancer.",Bob Fosse,Roy Scheider,Jessica Lange,Ann Reinking,,
"https://m.media-amazon.com/images/M/MV5BMzc1YTIyNjctYzhlNy00ZmYzLWI2ZWQtMzk4MmQwYzA0NGQ1XkEyXkFqcGdeQXVyMTQxNzMzNDI@._V1_UX67_CR0,0,67,98_AL_.jpg",Dawn of the Dead,1978,"Action, Adventure, Horror","Following an ever-growing epidemic of zombies that have risen from the dead, two Philadelphia S.W.A.T. team members, a traffic reporter, and his television executive girlfriend seek refuge in a secluded shopping mall.",George A. Romero,David Emge,Ken Foree,Scott H. Reiniger,,
"https://m.media-amazon.com/images/M/MV5BOWI2YWQxM2MtY2U4Yi00YjgzLTgwNzktN2ExNTgzNTIzMmUzXkEyXkFqcGdeQXVyMTAwMzUyOTc@._V1_UX67_CR0,0,67,98_AL_.jpg",All the President's Men,1976,"Biography, Drama, History","""The Washington Post"" reporters Bob Woodward and Carl Bernstein uncover the details of the Watergate scandal that leads to President Richard Nixon's resignation.",Alan J. Pakula,Dustin Hoffman,Robert Redford,Jack Warden,,
"https://m.media-amazon.com/images/M/MV5BN2IzM2I5NTQtMTIyMy00YWM2LWI1OGMtNjI0MWIyNDZkZGFkXkEyXkFqcGdeQXVyMTQxNzMzNDI@._V1_UX67_CR0,0,67,98_AL_.jpg",La montaña sagrada,1973,"Adventure, Drama, Fantasy","In a corrupt, greed-fueled world, a powerful alchemist leads a messianic character and seven materialistic figures to the Holy Mountain, where they hope to achieve enlightenment.",Alejandro Jodorowsky,Alejandro Jodorowsky,Horacio Salinas,Zamira Saunders,,
"https://m.media-amazon.com/images/M/MV5BZDI2OTg2NDQtMzc0MC00MjRiLWI1NzAtMjY2ZDMwMmUyNzBiXkEyXkFqcGdeQXVyNzM0MTUwNTY@._V1_UX67_CR0,0,67,98_AL_.jpg",Amarcord,1973,"Comedy, Drama, Family",A series of comedic and nostalgic vignettes set in a 1930s Italian coastal town.,Federico Fellini,Magali Noël,Bruno Zanin,Pupella Maggio,,
"https://m.media-amazon.com/images/M/MV5BYzQ5NjJiYWQtYjAzMC00NGU0LWFlMDYtNGFiYjFlMWI1NWM0XkEyXkFqcGdeQXVyODQ0OTczOQ@@._V1_UY98_CR4,0,67,98_AL_.jpg",Le charme discret de la bourgeoisie,1972,Comedy,"A surreal, virtually plotless series of dreams centered around six middle-class people and their consistently interrupted attempts to have a meal together.",Luis Buñuel,Fernando Rey,Delphine Seyrig,Paul Frankeur,,
"https://m.media-amazon.com/images/M/MV5BMjRkY2VhYzMtZWQyNS00OTY2LWE5NTAtYjlhNmQyYzE5MmUxXkEyXkFqcGdeQXVyMTQxNzMzNDI@._V1_UX67_CR0,0,67,98_AL_.jpg","Aguirre, der Zorn Gottes",1972,"Action, Adventure, Biography","In the 16th century, the ruthless and insane Don Lope de Aguirre leads a Spanish expedition in search of El Dorado.",Werner Herzog,Klaus Kinski,Ruy Guerra,Helena Rojo,,
"https://m.media-amazon.com/images/M/MV5BY2M5Mzg3NjctZTlkNy00MTU0LWFlYTQtY2E2Y2M4NjNiNzllXkEyXkFqcGdeQXVyMTAwMzUyOTc@._V1_UX67_CR0,0,67,98_AL_.jpg",Harold and Maude,1971,"Comedy, Drama, Romance","Young, rich, and obsessed with death, Harold finds himself changed forever when he meets lively septuagenarian Maude at a funeral.",Hal Ashby,Ruth Gordon,Bud Cort,Vivian Pickles,,
"https://m.media-amazon.com/images/M/MV5BMmNhZmJhMmYtNjlkMC00MjhjLTk1NzMtMTNlMzYzNjZlMjNiXkEyXkFqcGdeQXVyMTQxNzMzNDI@._V1_UX67_CR0,0,67,98_AL_.jpg",Patton,1970,"Biography, Drama, War",The World War II phase of the career of controversial American general George S. Patton.,Franklin J. Schaffner,George C. Scott,Karl Malden,Stephen Young,,
"https://m.media-amazon.com/images/M/MV5BNGUyYTZmOWItMDJhMi00N2IxLWIyNDMtNjUxM2ZiYmU5YWU1XkEyXkFqcGdeQXVyNjc1NTYyMjg@._V1_UX67_CR0,0,67,98_AL_.jpg",The Wild Bunch,1969,"Action, Adventure, Western","An aging group of outlaws look for one last big score as the ""traditional"" American West is disappearing around them.",Sam Peckinpah,William Holden,Ernest Borgnine,Robert Ryan,,
"https://m.media-amazon.com/images/M/MV5BMzRmN2E1ZDUtZDc2ZC00ZmI3LTkwOTctNzE2ZDIzMGJiMTYzXkEyXkFqcGdeQXVyMTQxNzMzNDI@._V1_UX67_CR0,0,67,98_AL_.jpg",Night of the Living Dead,1968,"Horror, Thriller",A ragtag group of Pennsylvanians barricade themselves in an old farmhouse to remain safe from a horde of flesh-eating ghouls that are ravaging the East Coast of the United States.,George A. Romero,Duane Jones,Judith O'Dea,Karl Hardman,,
"https://m.media-amazon.com/images/M/MV5BMTkzNzYyMzA5N15BMl5BanBnXkFtZTgwODcwODQ3MDI@._V1_UX67_CR0,0,67,98_AL_.jpg",The Lion in Winter,1968,"Biography, Drama, History","1183 A.D.: King Henry II's three sons all want to inherit the throne, but he won't commit to a choice. They and his wife variously plot to force him.",Anthony Harvey,Peter O'Toole,Katharine Hepburn,Anthony Hopkins,,
"https://m.media-amazon.com/images/M/MV5BZjZhZTZkNWItZGE1My00MTRkLWI2ZDktMWZkZTIxZWYxOTgzXkEyXkFqcGdeQXVyNDY2MTk1ODk@._V1_UX67_CR0,0,67,98_AL_.jpg",In the Heat of the Night,1967,"Crime, Drama, Mystery",A black police detective is asked to investigate a murder in a racially hostile southern town.,Norman Jewison,Sidney Poitier,Rod Steiger,Warren Oates,,
"https://m.media-amazon.com/images/M/MV5BMTA0Y2UyMDUtZGZiOS00ZmVkLTg3NmItODQyNTY1ZjU1MWE4L2ltYWdlL2ltYWdlXkEyXkFqcGdeQXVyNjc1NTYyMjg@._V1_UX67_CR0,0,67,98_AL_.jpg",Charade,1963,"Comedy, Mystery, Romance",Romance and suspense ensue in Paris as a woman is pursued by several men who want a fortune her murdered husband had stolen. Whom can she trust?,Stanley Donen,Cary Grant,Audrey Hepburn,Walter Matthau,,
"https://m.media-amazon.com/images/M/MV5BOTY0ZTA1ZjUtN2MyNi00ZGRmLWExYmMtOTkyNzI1NGQ2Y2RlXkEyXkFqcGdeQXVyNjc1NTYyMjg@._V1_UX67_CR0,0,67,98_AL_.jpg",The Manchurian Candidate,1962,"Drama, Thriller",A former prisoner of war is brainwashed as an unwitting assassin for an international Communist conspiracy.,John Frankenheimer,Frank Sinatra,Laurence Harvey,Janet Leigh,,
"https://m.media-amazon.com/images/M/MV5BMjc4MTUxN2UtMmU1NC00MjQyLTk3YTYtZTQ0YzEzZDc0Njc0XkEyXkFqcGdeQXVyNjU0OTQ0OTY@._V1_UX67_CR0,0,67,98_AL_.jpg",Spartacus,1960,"Adventure, Biography, Drama",The slave Spartacus leads a violent revolt against the decadent Roman Republic.,Stanley Kubrick,Kirk Douglas,Laurence Olivier,Jean Simmons,,
"https://m.media-amazon.com/images/M/MV5BZDFlODBmZTYtMWU4MS00MzY4LWFmYzYtYzAzZmU1MGUzMDE5XkEyXkFqcGdeQXVyNTc1NDM0NDU@._V1_UY98_CR1,0,67,98_AL_.jpg",L'avventura,1960,"Drama, Mystery","A woman disappears during a Mediterranean boating trip. During the search, her lover and her best friend become attracted to each other.",Michelangelo Antonioni,Gabriele Ferzetti,Monica Vitti,Lea Massari,,
"https://m.media-amazon.com/images/M/MV5BMzY2NTA1MzUwN15BMl5BanBnXkFtZTgwOTc4NTU4MjE@._V1_UX67_CR0,0,67,98_AL_.jpg",Hiroshima mon amour,1959,"Drama, Romance",A French actress filming an anti-war film in Hiroshima has an affair with a married Japanese architect as they share their differing perspectives on war.,Alain Resnais,Emmanuelle Riva,Eiji Okada,Stella Dassas,,
"https://m.media-amazon.com/images/M/MV5BODcxYjUxZDgtYTQ5Zi00YmQ1LWJmZmItODZkOTYyNDhiNWM3XkEyXkFqcGdeQXVyNjc1NTYyMjg@._V1_UX67_CR0,0,67,98_AL_.jpg",The Ten Commandments,1956,"Adventure, Drama","Moses, an Egyptian Prince, learns of his true heritage as a Hebrew and his divine mission as the deliverer of his people.",Cecil B. DeMille,Charlton Heston,Yul Brynner,Anne Baxter,,
"https://m.media-amazon.com/images/M/MV5BYWQ3YWJiMDEtMDBhNS00YjY1LTkzNmEtY2U4Njg4MjQ3YWE3XkEyXkFqcGdeQXVyNzkwMjQ5NzM@._V1_UX67_CR0,0,67,98_AL_.jpg",The Searchers,1956,"Adventure, Drama, Western",An American Civil War veteran embarks on a journey to rescue his niece from the Comanches.,John Ford,John Wayne,Jeffrey Hunter,Vera Miles,,
"https://m.media-amazon.com/images/M/MV5BMzE1MzdjNmUtOWU5MS00OTgwLWIzYjYtYTYwYTM0NDkyOTU1XkEyXkFqcGdeQXVyMTY5Nzc4MDY@._V1_UX67_CR0,0,67,98_AL_.jpg",East of Eden,1955,Drama,"Two brothers struggle to maintain their strict, Bible-toting father's favor.",Elia Kazan,James Dean,Raymond Massey,Julie Harris,,
"https://m.media-amazon.com/images/M/MV5BOWIzZGUxZmItOThkMS00Y2QxLTg0MTYtMDdhMjRlNTNlYTI3L2ltYWdlXkEyXkFqcGdeQXVyNjc1NTYyMjg@._V1_UX67_CR0,0,67,98_AL_.jpg",High Noon,1952,"Drama, Thriller, Western","A town Marshal, despite the disagreements of his newlywed bride and the townspeople around him, must face a gang of deadly killers alone at high noon when the gang leader, an outlaw he sent up years ago, arrives on the noon train.",Fred Zinnemann,Gary Cooper,Grace Kelly,Thomas Mitchell,,
"https://m.media-amazon.com/images/M/MV5BNzkwNjk4ODgtYjRmMi00ODdhLWIyNjUtNWQyMjg2N2E2NjlhXkEyXkFqcGdeQXVyNjE5MjUyOTM@._V1_UX67_CR0,0,67,98_AL_.jpg",Strangers on a Train,1951,"Crime, Film-Noir, Thriller",A psychopath forces a tennis star to comply with his theory that two strangers can get away with murder.,Alfred Hitchcock,Farley Granger,Robert Walker,Ruth Roman,,
"https://m.media-amazon.com/images/M/MV5BMzg2YTFkNjgtM2ZkNS00MWVkLWIwMTEtZTgzMDM2MmUxNDE2XkEyXkFqcGdeQXVyMjI4MjA5MzA@._V1_UX67_CR0,0,67,98_AL_.jpg",Harvey,1950,"Comedy, Drama, Fantasy","Due to his insistence that he has an invisible six foot-tall rabbit for a best friend, a whimsical middle-aged man is thought by his family to be insane - but he may be wiser than anyone knows.",Henry Koster,James Stewart,Wallace Ford,William H. Lynn,,
"https://m.media-amazon.com/images/M/MV5BNjRkOGEwYTUtY2E5Yy00ODg4LTk2ZWItY2IyMzUxOGVhMTM1XkEyXkFqcGdeQXVyNDk0MDg4NDk@._V1_UX67_CR0,0,67,98_AL_.jpg",Miracle on 34th Street,1947,"Comedy, Drama, Family","When a nice old man who claims to be Santa Claus is institutionalized as insane, a young lawyer decides to defend him by arguing in court that he is the real thing.",George Seaton,Edmund Gwenn,Maureen O'Hara,John Payne,,
"https://m.media-amazon.com/images/M/MV5BYTc1NGViOTMtNjZhNS00OGY2LWI4MmItOWQwNTY4MDMzNWI3L2ltYWdlXkEyXkFqcGdeQXVyNjc1NTYyMjg@._V1_UX67_CR0,0,67,98_AL_.jpg",Notorious,1946,"Drama, Film-Noir, Romance",A woman is asked to spy on a group of Nazi friends in South America. How far will she have to go to ingratiate herself with them?,Alfred Hitchcock,Cary Grant,Ingrid Bergman,Claude Rains,,
"https://m.media-amazon.com/images/M/MV5BMjdiM2IyZmQtODJiYy00NDNkLTllYmItMmFjMDNiYTQyOGVkXkEyXkFqcGdeQXVyNDY2MTk1ODk@._V1_UX67_CR0,0,67,98_AL_.jpg",The Big Sleep,1946,"Crime, Film-Noir, Mystery","Private detective Philip Marlowe is hired by a wealthy family. Before the complex case is over, he's seen murder, blackmail, and what might be love.",Howard Hawks,Humphrey Bogart,Lauren Bacall,John Ridgely,,
"https://m.media-amazon.com/images/M/MV5BMTk4NDQ0NjgyNF5BMl5BanBnXkFtZTgwMTE3NTkxMTE@._V1_UX67_CR0,0,67,98_AL_.jpg",The Lost Weekend,1945,"Drama, Film-Noir",The desperate life of a chronic alcoholic is followed through a four-day drinking bout.,Billy Wilder,Ray Milland,Jane Wyman,Phillip Terry,,
"https://m.media-amazon.com/images/M/MV5BYjQ4ZDA4NGMtMTkwYi00NThiLThhZDUtZTEzNTAxOWYyY2E4XkEyXkFqcGdeQXVyMjUxODE0MDY@._V1_UX67_CR0,0,67,98_AL_.jpg",The Philadelphia Story,1940,"Comedy, Romance","When a rich woman's ex-husband and a tabloid-type reporter turn up just before her planned remarriage, she begins to learn the truth about herself.",George Cukor,Cary Grant,Katharine Hepburn,James Stewart,,
"https://m.media-amazon.com/images/M/MV5BZDVmZTZkYjMtNmViZC00ODEzLTgwNDAtNmQ3OGQwOWY5YjFmXkEyXkFqcGdeQXVyNDY2MTk1ODk@._V1_UX67_CR0,0,67,98_AL_.jpg",His Girl Friday,1940,"Comedy, Drama, Romance",A newspaper editor uses every trick in the book to keep his ace reporter ex-wife from remarrying.,Howard Hawks,Cary Grant,Rosalind Russell,Ralph Bellamy,,
"https://m.media-amazon.com/images/M/MV5BYjZjOTU3MTMtYTM5YS00YjZmLThmNmMtODcwOTM1NmRiMWM2XkEyXkFqcGdeQXVyNjc1NTYyMjg@._V1_UX67_CR0,0,67,98_AL_.jpg",The Adventures of Robin Hood,1938,"Action, Adventure, Romance","When Prince John and the Norman Lords begin oppressing the Saxon masses in King Richard's absence, a Saxon lord fights back as the outlaw leader of a rebel guerrilla army.",Michael Curtiz,William Keighley,Errol Flynn,Olivia de Havilland,,
"https://m.media-amazon.com/images/M/MV5BYTJmNmQxNGItNDNlMC00MDU3LWFhNzMtZDQ2NDY0ZTVkNjE3XkEyXkFqcGdeQXVyMDI2NDg0NQ@@._V1_UX67_CR0,0,67,98_AL_.jpg",A Night at the Opera,1935,"Comedy, Music, Musical",A sly business manager and two wacky friends of two opera singers help them achieve success while humiliating their stuffy and snobbish enemies.,Sam Wood,Edmund Goulding,Groucho Marx,Chico Marx,,
"https://m.media-amazon.com/images/M/MV5BZTY3YjYxZGQtMTM2YS00ZmYwLWFlM2QtOWFlMTU1NTAyZDQ2XkEyXkFqcGdeQXVyNTgyNTA4MjM@._V1_UX67_CR0,0,67,98_AL_.jpg",King Kong,1933,"Adventure, Horror, Sci-Fi",A film crew goes to a tropical island for an exotic location shoot and discovers a colossal ape who takes a shine to their female blonde star. He is then captured and brought back to New York City for public exhibition.,Merian C. Cooper,Ernest B. Schoedsack,Fay Wray,Robert Armstrong,,
"https://m.media-amazon.com/images/M/MV5BMjMyYjgyOTQtZDVlZS00NTQ0LWJiNDItNGRlZmM3Yzc0N2Y0XkEyXkFqcGdeQXVyNTA4NzY1MzY@._V1_UX67_CR0,0,67,98_AL_.jpg",Freaks,1932,"Drama, Horror","A circus' beautiful trapeze artist agrees to marry the leader of side-show performers, but his deformed friends discover she is only marrying him for his inheritance.",Tod Browning,Wallace Ford,Leila Hyams,Olga Baclanova,,
"https://m.media-amazon.com/images/M/MV5BMTAxYjEyMTctZTg3Ni00MGZmLWIxMmMtOGM2NTFiY2U3MmExXkEyXkFqcGdeQXVyNzkwMjQ5NzM@._V1_UX67_CR0,0,67,98_AL_.jpg",Nosferatu,1922,"Fantasy, Horror",Vampire Count Orlok expresses interest in a new residence and real estate agent Hutter's wife.,F.W. Murnau,Max Schreck,Alexander Granach,Gustav von Wangenheim,,
"https://m.media-amazon.com/images/M/MV5BMTlkMmVmYjktYTc2NC00ZGZjLWEyOWUtMjc2MDMwMjQwOTA5XkEyXkFqcGdeQXVyNTI4MzE4MDU@._V1_UX67_CR0,0,67,98_AL_.jpg",The Gentlemen,2019,"Action, Comedy, Crime","An American expat tries to sell off his highly profitable marijuana empire in London, triggering plots, schemes, bribery and blackmail in an attempt to steal his domain out from under him.",Guy Ritchie,Matthew McConaughey,Charlie Hunnam,Michelle Dockery,,
"https://m.media-amazon.com/images/M/MV5BZmVhN2JlYjEtZWFkOS00YzE0LThiNDMtMGI3NDA1MTk2ZDQ2XkEyXkFqcGdeQXVyODE5NzE3OTE@._V1_UY98_CR0,0,67,98_AL_.jpg",Raazi,2018,"Action, Drama, Thriller",A Kashmiri woman agrees to marry a Pakistani army officer in order to spy on Pakistan during the Indo-Pakistan War of 1971.,Meghna Gulzar,Alia Bhatt,Vicky Kaushal,Rajit Kapoor,,
"https://m.media-amazon.com/images/M/MV5BNjcyYjg0M2ItMzMyZS00NmM1LTlhZDMtN2MxN2RhNWY4YTkwXkEyXkFqcGdeQXVyNjY1MTg4Mzc@._V1_UX67_CR0,0,67,98_AL_.jpg",Sound of Metal,2019,"Drama, Music",A heavy-metal drummer's life is thrown into freefall when he begins to lose his hearing.,Darius Marder,Riz Ahmed,Olivia Cooke,Paul Raci,,
"https://m.media-amazon.com/images/M/MV5BMTBkMjMyN2UtNzVjNi00Y2ZiLTk2MDYtN2Y0MjgzYjAxNzE4XkEyXkFqcGdeQXVyNjkxOTM4ODY@._V1_UY98_CR1,0,67,98_AL_.jpg",Forushande,2016,Drama,"While both participating in a production of ""Death of a Salesman,"" a teacher's wife is assaulted in her new home, which leaves him determined to find the perpetrator over his wife's traumatized objections.",Asghar Farhadi,Shahab Hosseini,Taraneh Alidoosti,Babak Karimi,,
"https://m.media-amazon.com/images/M/MV5BN2YyZjQ0NTEtNzU5MS00NGZkLTg0MTEtYzJmMWY3MWRhZjM2XkEyXkFqcGdeQXVyMDA4NzMyOA@@._V1_UX67_CR0,0,67,98_AL_.jpg",Dunkirk,2017,"Action, Drama, History","Allied soldiers from Belgium, the British Empire, and France are surrounded by the German Army and evacuated during a fierce battle in World War II.",Christopher Nolan,Fionn Whitehead,Barry Keoghan,Mark Rylance,,
"https://m.media-amazon.com/images/M/MV5BNDQzZmQ5MjItYmJlNy00MGI2LWExMDQtMjBiNjNmMzc5NTk1XkEyXkFqcGdeQXVyNjY1OTY4MTk@._V1_UY98_CR1,0,67,98_AL_.jpg",Perfetti sconosciuti,2016,"Comedy, Drama","Seven long-time friends get together for a dinner. When they decide to share with each other the content of every text message, email and phone call they receive, many secrets start to unveil and the equilibrium trembles.",Paolo Genovese,Giuseppe Battiston,Anna Foglietta,Marco Giallini,,
"https://m.media-amazon.com/images/M/MV5BMzg2Mzg4YmUtNDdkNy00NWY1LWE3NmEtZWMwNGNlMzE5YzU3XkEyXkFqcGdeQXVyMjA5MTIzMjQ@._V1_UX67_CR0,0,67,98_AL_.jpg",Hidden Figures,2016,"Biography, Drama, History",The story of a team of female African-American mathematicians who served a vital role in NASA during the early years of the U.S. space program.,Theodore Melfi,Taraji P. Henson,Octavia Spencer,Janelle Monáe,,
"https://m.media-amazon.com/images/M/MV5BMmYwNWZlNzEtNjE4Zi00NzQ4LWI2YmUtOWZhNzZhZDYyNmVmXkEyXkFqcGdeQXVyNzYzODM3Mzg@._V1_UX67_CR0,0,67,98_AL_.jpg",Paddington 2,2017,"Adventure, Comedy, Family","Paddington (Ben Whishaw), now happily settled with the Brown family and a popular member of the local community, picks up a series of odd jobs to buy the perfect present for his Aunt Lucy's (Imelda Staunton's) 100th birthday, only for the gift to be stolen.",Paul King,Ben Whishaw,Hugh Grant,Hugh Bonneville,,
"https://m.media-amazon.com/images/M/MV5BY2YxNjQxYWYtYzNkMi00YTgyLWIwZTMtYzgyYjZlZmYzZTA0XkEyXkFqcGdeQXVyMTA4NjE0NjEy._V1_UX67_CR0,0,67,98_AL_.jpg",Udta Punjab,2016,"Action, Crime, Drama",A story that revolves around drug abuse in the affluent north Indian State of Punjab and how the youth there have succumbed to it en-masse resulting in a socio-economic decline.,Abhishek Chaubey,Shahid Kapoor,Alia Bhatt,Kareena Kapoor,,
"https://m.media-amazon.com/images/M/MV5BMjA2Mzg2NDMzNl5BMl5BanBnXkFtZTgwMjcwODUzOTE@._V1_UX67_CR0,0,67,98_AL_.jpg",Kubo and the Two Strings,2016,"Animation, Action, Adventure",A young boy named Kubo must locate a magical suit of armour worn by his late father in order to defeat a vengeful spirit from the past.,Travis Knight,Charlize Theron,Art Parkinson,Matthew McConaughey,,
"https://m.media-amazon.com/images/M/MV5BZjAzZjZiMmQtMDZmOC00NjVmLTkyNTItOGI2Mzg4NTBhZTA1XkEyXkFqcGdeQXVyODE5NzE3OTE@._V1_UY98_CR0,0,67,98_AL_.jpg",M.S. Dhoni: The Untold Story,2016,"Biography, Drama, Sport",The untold story of Mahendra Singh Dhoni's journey from ticket collector to trophy collector - the world-cup-winning captain of the Indian Cricket Team.,Neeraj Pandey,Sushant Singh Rajput,Kiara Advani,Anupam Kher,,
"https://m.media-amazon.com/images/M/MV5BMTYxMjk0NDg4Ml5BMl5BanBnXkFtZTgwODcyNjA5OTE@._V1_UX67_CR0,0,67,98_AL_.jpg",Manchester by the Sea,2016,Drama,A depressed uncle is asked to take care of his teenage nephew after the boy's father dies.,Kenneth Lonergan,Casey Affleck,Michelle Williams,Kyle Chandler,,
"https://m.media-amazon.com/images/M/MV5BMjA0MzQzNjM1Ml5BMl5BanBnXkFtZTgwNjM5MjU5NjE@._V1_UX67_CR0,0,67,98_AL_.jpg",Under sandet,2015,"Drama, History, War","In post-World War II Denmark, a group of young German POWs are forced to clear a beach of thousands of land mines under the watch of a Danish Sergeant who slowly learns to appreciate their plight.",Martin Zandvliet,Roland Møller,Louis Hofmann,Joel Basman,,
"https://m.media-amazon.com/images/M/MV5BMjEwMzMxODIzOV5BMl5BanBnXkFtZTgwNzg3OTAzMDI@._V1_UX67_CR0,0,67,98_AL_.jpg",Rogue One,2016,"Action, Adventure, Sci-Fi",The daughter of an Imperial scientist joins the Rebel Alliance in a risky move to steal the plans for the Death Star.,Gareth Edwards,Felicity Jones,Diego Luna,Alan Tudyk,,
"https://m.media-amazon.com/images/M/MV5BMjQ0MTgyNjAxMV5BMl5BanBnXkFtZTgwNjUzMDkyODE@._V1_UX67_CR0,0,67,98_AL_.jpg",Captain America: Civil War,2016,"Action, Adventure, Sci-Fi",Political involvement in the Avengers' affairs causes a rift between Captain America and Iron Man.,Anthony Russo,Joe Russo,Chris Evans,Robert Downey Jr.,,
"https://m.media-amazon.com/images/M/MV5BMjA1MTc1NTg5NV5BMl5BanBnXkFtZTgwOTM2MDEzNzE@._V1_UX67_CR0,0,67,98_AL_.jpg",The Hateful Eight,2015,"Crime, Drama, Mystery","In the dead of a Wyoming winter, a bounty hunter and his prisoner find shelter in a cabin currently inhabited by a collection of nefarious characters.",Quentin Tarantino,Samuel L. Jackson,Kurt Russell,Jennifer Jason Leigh,,
"https://m.media-amazon.com/images/M/MV5BY2QzYTQyYzItMzAwYi00YjZlLThjNTUtNzMyMDdkYzJiNWM4XkEyXkFqcGdeQXVyMTkxNjUyNQ@@._V1_UX67_CR0,0,67,98_AL_.jpg",Little Women,2019,"Drama, Romance","Jo March reflects back and forth on her life, telling the beloved story of the March sisters - four young women, each determined to live life on her own terms.",Greta Gerwig,Saoirse Ronan,Emma Watson,Florence Pugh,,
"https://m.media-amazon.com/images/M/MV5BMTU3NjE2NjgwN15BMl5BanBnXkFtZTgwNDYzMzEwMzI@._V1_UX67_CR0,0,67,98_AL_.jpg",Loving Vincent,2017,"Animation, Biography, Crime","In a story depicted in oil painted animation, a young man comes to the last hometown of painter Vincent van Gogh (Robert Gulaczyk) to deliver the troubled artist's final letter and ends up investigating his final days there.",Dorota Kobiela,Hugh Welchman,Douglas Booth,Jerome Flynn,,
"https://m.media-amazon.com/images/M/MV5BMTU2OTcyOTE3MF5BMl5BanBnXkFtZTgwNTg5Mjc1MjE@._V1_UX67_CR0,0,67,98_AL_.jpg",Pride,2014,"Biography, Comedy, Drama",U.K. gay activists work to help miners during their lengthy strike of the National Union of Mineworkers in the summer of 1984.,Matthew Warchus,Bill Nighy,Imelda Staunton,Dominic West,,
"https://m.media-amazon.com/images/M/MV5BMTcxNTgzNDg1N15BMl5BanBnXkFtZTgwNjg4MzI1MDE@._V1_UX67_CR0,0,67,98_AL_.jpg",Le passé,2013,"Drama, Mystery","An Iranian man deserts his French wife and her two children to return to his homeland. Meanwhile, his wife starts up a new relationship, a reality her husband confronts upon his wife's request for a divorce.",Asghar Farhadi,Bérénice Bejo,Tahar Rahim,Ali Mosaffa,,
"https://m.media-amazon.com/images/M/MV5BNjg5NmI3NmUtZDQ2Mi00ZTI0LWE0YzAtOGRhOWJmNDJkOWNkXkEyXkFqcGdeQXVyMzIzNDU1NTY@._V1_UY98_CR0,0,67,98_AL_.jpg",La grande bellezza,2013,Drama,"Jep Gambardella has seduced his way through the lavish nightlife of Rome for decades, but after his 65th birthday and a shock from the past, Jep looks past the nightclubs and parties to find a timeless landscape of absurd, exquisite beauty.",Paolo Sorrentino,Toni Servillo,Carlo Verdone,Sabrina Ferilli,,
"https://m.media-amazon.com/images/M/MV5BMTUwMzc1NjIzMV5BMl5BanBnXkFtZTgwODUyMTIxMTE@._V1_UX67_CR0,0,67,98_AL_.jpg",The Lunchbox,2013,"Drama, Romance",A mistaken delivery in Mumbai's famously efficient lunchbox delivery system connects a young housewife to an older man in the dusk of his life as they build a fantasy world together through notes in the lunchbox.,Ritesh Batra,Irrfan Khan,Nimrat Kaur,Nawazuddin Siddiqui,,
