Image,MovieTitle,Year,Genre,Overview,Director,Star1,Star2,Star3,,
"https://m.media-amazon.com/images/M/MV5BYTg1MmNiMjItMmY4Yy00ZDQ3LThjMzYtZGQ0ZTQzNTdkMGQ1L2ltYWdlL2ltYWdlXkEyXkFqcGdeQXVyMTQxNzMzNDI@._V1_UX67_CR0,0,67,98_AL_.jpg",Trois couleurs: Rouge,1994,"Drama, Mystery, Romance",A model discovers a retired judge is keen on invading people's privacy.,Krzysztof Kieslowski,Irène Jacob,Jean-Louis Trintignant,Frédérique Feder,,
"https://m.media-amazon.com/images/M/MV5BMGQ5MzljNzYtMDM1My00NmI0LThlYzQtMTg0ZmQ0MTk1YjkxXkEyXkFqcGdeQXVyNTAyODkwOQ@@._V1_UY98_CR1,0,67,98_AL_.jpg",Chung Hing sam lam,1994,"Comedy, Crime, Drama","Two melancholy Hong Kong policemen fall in love: one with a mysterious female underworld figure, the other with a beautiful and ethereal server at a late-night restaurant he frequents.",Kar-Wai Wong,Brigitte Lin,Takeshi Kaneshiro,Tony Chiu-Wai Leung,,
"https://m.media-amazon.com/images/M/MV5BMjM2MDgxMDg0Nl5BMl5BanBnXkFtZTgwNTM2OTM5NDE@._V1_UX67_CR0,0,67,98_AL_.jpg",Jurassic Park,1993,"Action, Adventure, Sci-Fi",A pragmatic paleontologist visiting an almost complete theme park is tasked with protecting a couple of kids after a power failure causes the park's cloned dinosaurs to run loose.,Steven Spielberg,Sam Neill,Laura Dern,Jeff Goldblum,,
"https://m.media-amazon.com/images/M/MV5BMmYyOTgwYWItYmU3Ny00M2E2LTk0NWMtMDVlNmQ0MWZiMTMxXkEyXkFqcGdeQXVyNzkwMjQ5NzM@._V1_UX67_CR0,0,67,98_AL_.jpg",In the Name of the Father,1993,"Biography, Crime, Drama",A man's coerced confession to an I.R.A. bombing he did not commit results in the imprisonment of his father as well. An English lawyer fights to free them.,Jim Sheridan,Daniel Day-Lewis,Pete Postlethwaite,Alison Crosbie,,
"https://m.media-amazon.com/images/M/MV5BYmFhZmM3Y2MtNDA1Ny00NjkzLWJkM2EtYWU1ZjEwYmNjZDQ0XkEyXkFqcGdeQXVyMTMxMTY0OTQ@._V1_UX67_CR0,0,67,98_AL_.jpg",Ba wang bie ji,1993,"Drama, Music, Romance",Two boys meet at an opera training school in Peking in 1924. Their resulting friendship will span nearly 70 years and will endure some of the most troublesome times in China's history.,Kaige Chen,Leslie Cheung,Fengyi Zhang,Gong Li,,
"https://m.media-amazon.com/images/M/MV5BMjEzNjY5NDcwNV5BMl5BanBnXkFtZTcwNzEwMzg4NA@@._V1_UX67_CR0,0,67,98_AL_.jpg",Dà hóng denglong gaogao guà,1991,"Drama, History, Romance","A young woman becomes the fourth wife of a wealthy lord, and must learn to live with the strict rules and tensions within the household.",Yimou Zhang,Gong Li,Jingwu Ma,Saifei He,,
"https://m.media-amazon.com/images/M/MV5BOGYwYWNjMzgtNGU4ZC00NWQ2LWEwZjUtMzE1Zjc3NjY3YTU1XkEyXkFqcGdeQXVyMTQxNzMzNDI@._V1_UX67_CR0,0,67,98_AL_.jpg",Dead Poets Society,1989,"Comedy, Drama",Maverick teacher John Keating uses poetry to embolden his boarding school students to new heights of self-expression.,Peter Weir,Robin Williams,Robert Sean Leonard,Ethan Hawke,,
"https://m.media-amazon.com/images/M/MV5BODJmY2Y2OGQtMDg2My00N2Q3LWJmZTUtYTc2ODBjZDVlNDlhXkEyXkFqcGdeQXVyMTQxNzMzNDI@._V1_UX67_CR0,0,67,98_AL_.jpg",Stand by Me,1986,"Adventure, Drama","After the death of one of his friends, a writer recounts a childhood journey with his friends to find the body of a missing boy.",Rob Reiner,Wil Wheaton,River Phoenix,Corey Feldman,,
"https://m.media-amazon.com/images/M/MV5BMzRjZjdlMjQtODVkYS00N2YzLWJlYWYtMGVlN2E5MWEwMWQzXkEyXkFqcGdeQXVyMTQxNzMzNDI@._V1_UX67_CR0,0,67,98_AL_.jpg",Platoon,1986,"Drama, War","Chris Taylor, a neophyte recruit in Vietnam, finds himself caught in a battle of wills between two sergeants, one good and the other evil. A shrewd examination of the brutality of war and the duality of man in conflict.",Oliver Stone,Charlie Sheen,Tom Berenger,Willem Dafoe,,
"https://m.media-amazon.com/images/M/MV5BM2RjMmU3ZWItYzBlMy00ZmJkLWE5YzgtNTVkODdhOWM3NGZhXkEyXkFqcGdeQXVyNDA5Mjg5MjA@._V1_UX67_CR0,0,67,98_AL_.jpg","Paris, Texas",1984,Drama,"Travis Henderson, an aimless drifter who has been missing for four years, wanders out of the desert and must reconnect with society, himself, his life, and his family.",Wim Wenders,Harry Dean Stanton,Nastassja Kinski,Dean Stockwell,,
"https://m.media-amazon.com/images/M/MV5BZWFkN2ZhODAtYTNkZS00Y2NjLWIzNDYtNzJjNDNlMzAyNTIyXkEyXkFqcGdeQXVyODEzNjM5OTQ@._V1_UY98_CR1,0,67,98_AL_.jpg",Kaze no tani no Naushika,1984,"Animation, Adventure, Fantasy",Warrior and pacifist Princess Nausicaä desperately struggles to prevent two warring nations from destroying themselves and their dying planet.,Hayao Miyazaki,Sumi Shimamoto,Mahito Tsujimura,Hisako Kyôda,,
"https://m.media-amazon.com/images/M/MV5BNGViZWZmM2EtNGYzZi00ZDAyLTk3ODMtNzIyZTBjN2Y1NmM1XkEyXkFqcGdeQXVyNTAyODkwOQ@@._V1_UX67_CR0,0,67,98_AL_.jpg",The Thing,1982,"Horror, Mystery, Sci-Fi",A research team in Antarctica is hunted by a shape-shifting alien that assumes the appearance of its victims.,John Carpenter,Kurt Russell,Wilford Brimley,Keith David,,
"https://m.media-amazon.com/images/M/MV5BZDhlZTYxOTYtYTk3Ny00ZDljLTk3ZmItZTcxZWU5YTIyYmFkXkEyXkFqcGdeQXVyMTQxNzMzNDI@._V1_UX67_CR0,0,67,98_AL_.jpg",Pink Floyd: The Wall,1982,"Drama, Fantasy, Music",A confined but troubled rock star descends into madness in the midst of his physical and social isolation from everyone.,Alan Parker,Bob Geldof,Christine Hargreaves,James Laurenson,,
"https://m.media-amazon.com/images/M/MV5BYjIzNTYxMTctZjAwNS00YzI3LWExMGMtMGQxNGM5ZTc1NzhlXkEyXkFqcGdeQXVyMTQxNzMzNDI@._V1_UX67_CR0,0,67,98_AL_.jpg",Fitzcarraldo,1982,"Adventure, Drama","The story of Brian Sweeney Fitzgerald, an extremely determined man who intends to build an opera house in the middle of a jungle.",Werner Herzog,Klaus Kinski,Claudia Cardinale,José Lewgoy,,
"https://m.media-amazon.com/images/M/MV5BZmQzMDE5ZWQtOTU3ZS00ZjdhLWI0OTctZDNkODk4YThmOTRhL2ltYWdlXkEyXkFqcGdeQXVyNjc1NTYyMjg@._V1_UX67_CR0,0,67,98_AL_.jpg",Fanny och Alexander,1982,Drama,"Two young Swedish children experience the many comedies and tragedies of their family, the Ekdahls.",Ingmar Bergman,Bertil Guve,Pernilla Allwin,Kristina Adolphson,,
"https://m.media-amazon.com/images/M/MV5BNzQzMzJhZTEtOWM4NS00MTdhLTg0YjgtMjM4MDRkZjUwZDBlXkEyXkFqcGdeQXVyNjU0OTQ0OTY@._V1_UX67_CR0,0,67,98_AL_.jpg",Blade Runner,1982,"Action, Sci-Fi, Thriller","A blade runner must pursue and terminate four replicants who stole a ship in space, and have returned to Earth to find their creator.",Ridley Scott,Harrison Ford,Rutger Hauer,Sean Young,,
"https://m.media-amazon.com/images/M/MV5BMDVjNjIwOGItNDE3Ny00OThjLWE0NzQtZTU3YjMzZTZjMzhkXkEyXkFqcGdeQXVyMTQxNzMzNDI@._V1_UX67_CR0,0,67,98_AL_.jpg",The Elephant Man,1980,"Biography, Drama","A Victorian surgeon rescues a heavily disfigured man who is mistreated while scraping a living as a side-show freak. Behind his monstrous façade, there is revealed a person of kindness, intelligence and sophistication.",David Lynch,Anthony Hopkins,John Hurt,Anne Bancroft,,
"https://m.media-amazon.com/images/M/MV5BMzAwNjU1OTktYjY3Mi00NDY5LWFlZWUtZjhjNGE0OTkwZDkwXkEyXkFqcGdeQXVyMTQxNzMzNDI@._V1_UX67_CR0,0,67,98_AL_.jpg",Life of Brian,1979,Comedy,"Born on the original Christmas in the stable next door to Jesus Christ, Brian of Nazareth spends his life being mistaken for a messiah.",Terry Jones,Graham Chapman,John Cleese,Michael Palin,,
"https://m.media-amazon.com/images/M/MV5BNDhmNTA0ZDMtYjhkNS00NzEzLWIzYTItOGNkMTVmYjE2YmI3XkEyXkFqcGdeQXVyNzkwMjQ5NzM@._V1_UX67_CR0,0,67,98_AL_.jpg",The Deer Hunter,1978,"Drama, War",An in-depth examination of the ways in which the U.S. Vietnam War impacts and disrupts the lives of people in a small industrial town in Pennsylvania.,Michael Cimino,Robert De Niro,Christopher Walken,John Cazale,,
"https://m.media-amazon.com/images/M/MV5BMTY5MDMzODUyOF5BMl5BanBnXkFtZTcwMTQ3NTMyNA@@._V1_UX67_CR0,0,67,98_AL_.jpg",Rocky,1976,"Drama, Sport",A small-time boxer gets a supremely rare chance to fight a heavy-weight champion in a bout in which he strives to go the distance for his self-respect.,John G. Avildsen,Sylvester Stallone,Talia Shire,Burt Young,,
"https://m.media-amazon.com/images/M/MV5BZGNjYjM2MzItZGQzZi00NmY3LTgxOGUtMTQ2MWQxNWQ2MmMwXkEyXkFqcGdeQXVyNzM0MTUwNTY@._V1_UX67_CR0,0,67,98_AL_.jpg",Network,1976,Drama,A television network cynically exploits a deranged former anchor's ravings and revelations about the news media for its own profit.,Sidney Lumet,Faye Dunaway,William Holden,Peter Finch,,
"https://m.media-amazon.com/images/M/MV5BNmY0MWY2NDctZDdmMi00MjA1LTk0ZTQtZDMyZTQ1NTNlYzVjXkEyXkFqcGdeQXVyMjUzOTY1NTc@._V1_UX67_CR0,0,67,98_AL_.jpg",Barry Lyndon,1975,"Adventure, Drama, History",An Irish rogue wins the heart of a rich widow and assumes her dead husband's aristocratic position in 18th-century England.,Stanley Kubrick,Ryan O'Neal,Marisa Berenson,Patrick Magee,,
"https://m.media-amazon.com/images/M/MV5BMTg1MDg3OTk3M15BMl5BanBnXkFtZTgwMDEzMzE5MTE@._V1_UY98_CR0,0,67,98_AL_.jpg",Zerkalo,1975,"Biography, Drama","A dying man in his forties remembers his past. His childhood, his mother, the war, personal moments and things that tell of the recent history of all the Russian nation.",Andrei Tarkovsky,Margarita Terekhova,Filipp Yankovskiy,Ignat Daniltsev,,
"https://m.media-amazon.com/images/M/MV5BOGMwYmY5ZmEtMzY1Yi00OWJiLTk1Y2MtMzI2MjBhYmZkNTQ0XkEyXkFqcGdeQXVyNzkwMjQ5NzM@._V1_UX67_CR0,0,67,98_AL_.jpg",Chinatown,1974,"Drama, Mystery, Thriller","A private detective hired to expose an adulterer finds himself caught up in a web of deceit, corruption, and murder.",Roman Polanski,Jack Nicholson,Faye Dunaway,John Huston,,
"https://m.media-amazon.com/images/M/MV5BOWVmYzQwY2MtOTBjNi00MDNhLWI5OGMtN2RiMDYxODI3MjU5XkEyXkFqcGdeQXVyMjUzOTY1NTc@._V1_UX67_CR0,0,67,98_AL_.jpg",Paper Moon,1973,"Comedy, Crime, Drama","During the Great Depression, a con man finds himself saddled with a young girl who may or may not be his daughter, and the two forge an unlikely partnership.",Peter Bogdanovich,Ryan O'Neal,Tatum O'Neal,Madeline Kahn,,
"https://m.media-amazon.com/images/M/MV5BMTg3NzYzOTEtNmE2Ni00M2EyLWJhMjctNjMyMTk4ZTViOGUzXkEyXkFqcGdeQXVyNzQxNDExNTU@._V1_UY98_CR0,0,67,98_AL_.jpg",Viskningar och rop,1972,Drama,"When a woman dying of cancer in early twentieth-century Sweden is visited by her two sisters, long-repressed feelings between the siblings rise to the surface.",Ingmar Bergman,Harriet Andersson,Liv Ullmann,Kari Sylwan,,
"https://m.media-amazon.com/images/M/MV5BZmY4Yjc0OWQtZDRhMy00ODc2LWI2NGYtMWFlODYyN2VlNDQyXkEyXkFqcGdeQXVyNjU0OTQ0OTY@._V1_UY98_CR1,0,67,98_AL_.jpg",Solaris,1972,"Drama, Mystery, Sci-Fi",A psychologist is sent to a station orbiting a distant planet in order to discover what has caused the crew to go insane.,Andrei Tarkovsky,Natalya Bondarchuk,Donatas Banionis,Jüri Järvet,,
"https://m.media-amazon.com/images/M/MV5BMWFjZjRiM2QtZmRkOC00MDUxLTlhYmQtYmY5ZTNiMTI5Nzc2L2ltYWdlXkEyXkFqcGdeQXVyNTAyODkwOQ@@._V1_UX67_CR0,0,67,98_AL_.jpg",Le samouraï,1967,"Crime, Drama, Mystery",After professional hitman Jef Costello is seen by witnesses his efforts to provide himself an alibi drive him further into a corner.,Jean-Pierre Melville,Alain Delon,François Périer,Nathalie Delon,,
"https://m.media-amazon.com/images/M/MV5BOWFlNzZhYmYtYTI5YS00MDQyLWIyNTUtNTRjMWUwNTEzNjA0XkEyXkFqcGdeQXVyNjUwNzk3NDc@._V1_UX67_CR0,0,67,98_AL_.jpg",Cool Hand Luke,1967,"Crime, Drama","A laid back Southern man is sentenced to two years in a rural prison, but refuses to conform.",Stuart Rosenberg,Paul Newman,George Kennedy,Strother Martin,,
"https://m.media-amazon.com/images/M/MV5BMTM0YzExY2EtMjUyZi00ZmIwLWFkYTktNjY5NmVkYTdkMjI5XkEyXkFqcGdeQXVyNzQxNDExNTU@._V1_UY98_CR0,0,67,98_AL_.jpg",Persona,1966,"Drama, Thriller",A nurse is put in charge of a mute actress and finds that their personae are melding together.,Ingmar Bergman,Bibi Andersson,Liv Ullmann,Margaretha Krook,,
"https://m.media-amazon.com/images/M/MV5BNjM2MjMwNzUzN15BMl5BanBnXkFtZTgwMjEzMzE5MTE@._V1_UY98_CR2,0,67,98_AL_.jpg",Andrei Rublev,1966,"Biography, Drama, History","The life, times and afflictions of the fifteenth-century Russian iconographer St. Andrei Rublev.",Andrei Tarkovsky,Anatoliy Solonitsyn,Ivan Lapikov,Nikolay Grinko,,
"https://m.media-amazon.com/images/M/MV5BZWEzMGY4OTQtYTdmMy00M2QwLTliYTQtYWUzYzc3OTA5YzIwXkEyXkFqcGdeQXVyNjc1NTYyMjg@._V1_UY98_CR1,0,67,98_AL_.jpg",La battaglia di Algeri,1966,"Drama, War","In the 1950s, fear and violence escalate as the people of Algiers fight for independence from the French government.",Gillo Pontecorvo,Brahim Hadjadj,Jean Martin,Yacef Saadi,,
"https://m.media-amazon.com/images/M/MV5BZTg3M2ExY2EtZmI5Yy00YWM1LTg4NzItZWEzZTgxNzE2MjhhXkEyXkFqcGdeQXVyNDE5MTU2MDE@._V1_UX67_CR0,0,67,98_AL_.jpg",El ángel exterminador,1962,"Drama, Fantasy",The guests at an upper-class dinner party find themselves unable to leave.,Luis Buñuel,Silvia Pinal,Jacqueline Andere,Enrique Rambal,,
"https://m.media-amazon.com/images/M/MV5BZmI0M2VmNTgtMWVhYS00Zjg1LTk1YTYtNmJmMjRkZmMwYTc2XkEyXkFqcGdeQXVyNTA4NzY1MzY@._V1_UX67_CR0,0,67,98_AL_.jpg",What Ever Happened to Baby Jane?,1962,"Drama, Horror, Thriller",A former child star torments her paraplegic sister in their decaying Hollywood mansion.,Robert Aldrich,Bette Davis,Joan Crawford,Victor Buono,,
"https://m.media-amazon.com/images/M/MV5BZmY3MDlmODctYTY3Yi00NzYyLWIxNTUtYjVlZWZjMmMwZTBkXkEyXkFqcGdeQXVyMzAxNjg3MjQ@._V1_UX67_CR0,0,67,98_AL_.jpg",Sanjuro,1962,"Action, Comedy, Crime","A crafty samurai helps a young man and his fellow clansmen save his uncle, who has been framed and imprisoned by a corrupt superintendent.",Akira Kurosawa,Toshirô Mifune,Tatsuya Nakadai,Keiju Kobayashi,,
"https://m.media-amazon.com/images/M/MV5BMGEyNzhkYzktMGMyZS00YzRiLWJlYjktZjJkOTU5ZDY0ZGI4XkEyXkFqcGdeQXVyNjUwNzk3NDc@._V1_UX67_CR0,0,67,98_AL_.jpg",The Man Who Shot Liberty Valance,1962,"Drama, Western",A senator returns to a western town for the funeral of an old friend and tells the story of his origins.,John Ford,James Stewart,John Wayne,Vera Miles,,
"https://m.media-amazon.com/images/M/MV5BYTYzYzBhYjQtNDQxYS00MmUwLTkyZjgtZWVkOWFjNzE5OTI2XkEyXkFqcGdeQXVyNjMxMjkwMjI@._V1_UX67_CR0,0,67,98_AL_.jpg",Ivanovo detstvo,1962,"Drama, War","In WW2, twelve year old Soviet orphan Ivan Bondarev works for the Soviet army as a scout behind the German lines and strikes a friendship with three sympathetic Soviet officers.",Andrei Tarkovsky,Eduard Abalov,Nikolay Burlyaev,Valentin Zubkov,,
"https://m.media-amazon.com/images/M/MV5BZjgyMzZkMGUtNTBhZC00OTkzLWI4ZmMtYzcwMzc5MjQ0YTM3XkEyXkFqcGdeQXVyMTMxMTY0OTQ@._V1_UY98_CR3,0,67,98_AL_.jpg",Jungfrukällan,1960,Drama,"An innocent yet pampered young virgin and her family's pregnant and jealous servant set out to deliver candles to church, but only one returns from events that transpire in the woods along the way.",Ingmar Bergman,Max von Sydow,Birgitta Valberg,Gunnel Lindblom,,
"https://m.media-amazon.com/images/M/MV5BMGQ5ODNkNWYtYTgxZS00YjJkLThhODAtYzUwNGNiYjRmNjdkXkEyXkFqcGdeQXVyMTg2NTc4MzA@._V1_UY98_CR4,0,67,98_AL_.jpg",Inherit the Wind,1960,"Biography, Drama, History","Based on a real-life case in 1925, two great lawyers argue the case for and against a science teacher accused of the crime of teaching evolution.",Stanley Kramer,Spencer Tracy,Fredric March,Gene Kelly,,
"https://m.media-amazon.com/images/M/MV5BYTQ4MjA4NmYtYjRhNi00MTEwLTg0NjgtNjk3ODJlZGU4NjRkL2ltYWdlL2ltYWdlXkEyXkFqcGdeQXVyNjU0OTQ0OTY@._V1_UY98_CR3,0,67,98_AL_.jpg",Les quatre cents coups,1959,"Crime, Drama","A young boy, left without attention, delves into a life of petty crime.",François Truffaut,Jean-Pierre Léaud,Albert Rémy,Claire Maurier,,
"https://m.media-amazon.com/images/M/MV5BNjgxY2JiZDYtZmMwOC00ZmJjLWJmODUtMTNmNWNmYWI5ODkwL2ltYWdlL2ltYWdlXkEyXkFqcGdeQXVyNjc1NTYyMjg@._V1_UX67_CR0,0,67,98_AL_.jpg",Ben-Hur,1959,"Adventure, Drama, History","After a Jewish prince is betrayed and sent into slavery by a Roman friend, he regains his freedom and comes back for revenge.",William Wyler,Charlton Heston,Jack Hawkins,Stephen Boyd,,
"https://m.media-amazon.com/images/M/MV5BYjJkN2Y5MTktZDRhOS00NTUwLWFiMzEtMTVlNWU4ODM0Y2E5XkEyXkFqcGdeQXVyNjc1NTYyMjg@._V1_UY98_CR1,0,67,98_AL_.jpg",Kakushi-toride no san-akunin,1958,"Adventure, Drama","Lured by gold, two greedy peasants unknowingly escort a princess and her general across enemy lines.",Akira Kurosawa,Toshirô Mifune,Misa Uehara,Minoru Chiaki,,
"https://m.media-amazon.com/images/M/MV5BOTdhNmUxZmQtNmMwNC00MzE3LWE1MTUtZDgxZTYwYjEzZjcwXkEyXkFqcGdeQXVyNTA1NjYyMDk@._V1_UY98_CR0,0,67,98_AL_.jpg",Le notti di Cabiria,1957,Drama,A waifish prostitute wanders the streets of Rome looking for true love but finds only heartbreak.,Federico Fellini,Giulietta Masina,François Périer,Franca Marzi,,
"https://m.media-amazon.com/images/M/MV5BNGYxZjA2M2ItYTRmNS00NzRmLWJkYzgtYTdiNGFlZDI5ZjNmXkEyXkFqcGdeQXVyNDE5MTU2MDE@._V1_UY98_CR0,0,67,98_AL_.jpg",Kumonosu-jô,1957,"Drama, History","A war-hardened general, egged on by his ambitious wife, works to fulfill a prophecy that he would become lord of Spider's Web Castle.",Akira Kurosawa,Toshirô Mifune,Minoru Chiaki,Isuzu Yamada,,
"https://m.media-amazon.com/images/M/MV5BMGVhNjhjODktODgxYS00MDdhLTlkZjktYTkyNzQxMTU0ZDYxXkEyXkFqcGdeQXVyNzkwMjQ5NzM@._V1_UX67_CR0,0,67,98_AL_.jpg",The Bridge on the River Kwai,1957,"Adventure, Drama, War","British POWs are forced to build a railway bridge across the river Kwai for their Japanese captors, not knowing that the allied forces are planning to destroy it.",David Lean,William Holden,Alec Guinness,Jack Hawkins,,
"https://m.media-amazon.com/images/M/MV5BY2I0MWFiZDMtNWQyYy00Njk5LTk3MDktZjZjNTNmZmVkYjkxXkEyXkFqcGdeQXVyNjc1NTYyMjg@._V1_UX67_CR0,0,67,98_AL_.jpg",On the Waterfront,1954,"Crime, Drama, Thriller",An ex-prize fighter turned longshoreman struggles to stand up to his corrupt union bosses.,Elia Kazan,Marlon Brando,Karl Malden,Lee J. Cobb,,
"https://m.media-amazon.com/images/M/MV5BZDdkNzMwZmUtY2Q5MS00ZmM2LWJhYjItYTBjMWY0MGM4MDRjXkEyXkFqcGdeQXVyNTA4NzY1MzY@._V1_UY98_CR0,0,67,98_AL_.jpg",Le salaire de la peur,1953,"Adventure, Drama, Thriller","In a decrepit South American village, four men are hired to transport an urgent nitroglycerine shipment without the equipment that would make it safe.",Henri-Georges Clouzot,Yves Montand,Charles Vanel,Peter van Eyck,,
"https://m.media-amazon.com/images/M/MV5BNDUzZjlhZTYtN2E5MS00ODQ3LWI1ZjgtNzdiZmI0NTZiZTljXkEyXkFqcGdeQXVyMjI4MjA5MzA@._V1_UX67_CR0,0,67,98_AL_.jpg",Ace in the Hole,1951,"Drama, Film-Noir","A frustrated former big-city journalist now stuck working for an Albuquerque newspaper exploits a story about a man trapped in a cave to rekindle his career, but the situation quickly escalates into an out-of-control circus.",Billy Wilder,Kirk Douglas,Jan Sterling,Robert Arthur,,
"https://m.media-amazon.com/images/M/MV5BZmI5NTA3MjItYzdhMi00MWMxLTg3OWMtYWQyYjg5MTFmM2U0L2ltYWdlL2ltYWdlXkEyXkFqcGdeQXVyNjc1NTYyMjg@._V1_UX67_CR0,0,67,98_AL_.jpg",White Heat,1949,"Action, Crime, Drama",A psychopathic criminal with a mother complex makes a daring break from prison and leads his old gang in a chemical plant payroll heist.,Raoul Walsh,James Cagney,Virginia Mayo,Edmond O'Brien,,
"https://m.media-amazon.com/images/M/MV5BYjE2OTdhMWUtOGJlMy00ZDViLWIzZjgtYjZkZGZmMDZjYmEyXkEyXkFqcGdeQXVyNzkwMjQ5NzM@._V1_UX67_CR0,0,67,98_AL_.jpg",The Third Man,1949,"Film-Noir, Mystery, Thriller","Pulp novelist Holly Martins travels to shadowy, postwar Vienna, only to find himself investigating the mysterious death of an old friend, Harry Lime.",Carol Reed,Orson Welles,Joseph Cotten,Alida Valli,,
"https://m.media-amazon.com/images/M/MV5BOWRmNGEwZjUtZjEwNS00OGZmLThhMmEtZTJlMTU5MGQ3ZWUwXkEyXkFqcGdeQXVyNjc1NTYyMjg@._V1_UX67_CR0,0,67,98_AL_.jpg",The Red Shoes,1948,"Drama, Music, Romance",A young ballet dancer is torn between the man she loves and her pursuit to become a prima ballerina.,Michael Powell,Emeric Pressburger,Anton Walbrook,Marius Goring,,
"https://m.media-amazon.com/images/M/MV5BNzc1MTcyNTQ5N15BMl5BanBnXkFtZTgwMzgwMDI0MjE@._V1_UX67_CR0,0,67,98_AL_.jpg",The Shop Around the Corner,1940,"Comedy, Drama, Romance","Two employees at a gift shop can barely stand each other, without realizing that they are falling in love through the post as each other's anonymous pen pal.",Ernst Lubitsch,Margaret Sullavan,James Stewart,Frank Morgan,,
"https://m.media-amazon.com/images/M/MV5BYTcxYWExOTMtMWFmYy00ZjgzLWI0YjktNWEzYzJkZTg0NDdmL2ltYWdlXkEyXkFqcGdeQXVyNjc1NTYyMjg@._V1_UY98_CR0,0,67,98_AL_.jpg",Rebecca,1940,"Drama, Mystery, Romance",A self-conscious woman juggles adjusting to her new role as an aristocrat's wife and avoiding being intimidated by his first wife's spectral presence.,Alfred Hitchcock,Laurence Olivier,Joan Fontaine,George Sanders,,
"https://m.media-amazon.com/images/M/MV5BZTYwYjYxYzgtMDE1Ni00NzU4LWJlMTEtODQ5YmJmMGJhZjI5L2ltYWdlXkEyXkFqcGdeQXVyMDI2NDg0NQ@@._V1_UX67_CR0,0,67,98_AL_.jpg",Mr. Smith Goes to Washington,1939,"Comedy, Drama","A naive man is appointed to fill a vacancy in the United States Senate. His plans promptly collide with political corruption, but he doesn't back down.",Frank Capra,James Stewart,Jean Arthur,Claude Rains,,
"https://m.media-amazon.com/images/M/MV5BYjUyZWZkM2UtMzYxYy00ZmQ3LWFmZTQtOGE2YjBkNjA3YWZlXkEyXkFqcGdeQXVyNzkwMjQ5NzM@._V1_UX67_CR0,0,67,98_AL_.jpg",Gone with the Wind,1939,"Drama, History, Romance",A manipulative woman and a roguish man conduct a turbulent romance during the American Civil War and Reconstruction periods.,Victor Fleming,George Cukor,Sam Wood,Clark Gable,,
"https://m.media-amazon.com/images/M/MV5BMTg3MTI5NTk0N15BMl5BanBnXkFtZTgwMjU1MDM5MTE@._V1_UY98_CR2,0,67,98_AL_.jpg",La Grande Illusion,1937,"Drama, War","During WWI, two French soldiers are captured and imprisoned in a German P.O.W. camp. Several escape attempts follow until they are eventually sent to a seemingly inescapable fortress.",Jean Renoir,Jean Gabin,Dita Parlo,Pierre Fresnay,,
"https://m.media-amazon.com/images/M/MV5BYzJmMWE5NjAtNWMyZS00NmFiLWIwMDgtZDE2NzczYWFhNzIzXkEyXkFqcGdeQXVyNjc1NTYyMjg@._V1_UX67_CR0,0,67,98_AL_.jpg",It Happened One Night,1934,"Comedy, Romance","A renegade reporter and a crazy young heiress meet on a bus heading for New York, and end up stuck with each other when the bus leaves them behind at one of the stops.",Frank Capra,Clark Gable,Claudette Colbert,Walter Connolly,,
"https://m.media-amazon.com/images/M/MV5BNjBjNDJiYTUtOWY0OS00OGVmLTg2YzctMTE0NzVhODM1ZWJmXkEyXkFqcGdeQXVyNjU0OTQ0OTY@._V1_UX67_CR0,0,67,98_AL_.jpg",La passion de Jeanne d'Arc,1928,"Biography, Drama, History","In 1431, Jeanne d'Arc is placed on trial on charges of heresy. The ecclesiastical jurists attempt to force Jeanne to recant her claims of holy visions.",Carl Theodor Dreyer,Maria Falconetti,Eugene Silvain,André Berley,,
"https://m.media-amazon.com/images/M/MV5BM2QwYWQ0MWMtNzcwOC00N2Q2LWE1MDEtZmQxZjhiM2U1YzFhXkEyXkFqcGdeQXVyMTQxNzMzNDI@._V1_UX67_CR0,0,67,98_AL_.jpg",The Circus,1928,"Comedy, Romance",The Tramp finds work and the girl of his dreams at a circus.,Charles Chaplin,Charles Chaplin,Merna Kennedy,Al Ernest Garcia,,
"https://m.media-amazon.com/images/M/MV5BNDVkYmYwM2ItNzRiMy00NWQ4LTlhMjMtNDI1ZDYyOGVmMzJjXkEyXkFqcGdeQXVyNTgzMzU5MDI@._V1_UX67_CR0,0,67,98_AL_.jpg",Sunrise: A Song of Two Humans,1927,"Drama, Romance",An allegorical tale about a man fighting the good and evil within him. Both sides are made flesh - one a sophisticated woman he is attracted to and the other his wife.,F.W. Murnau,George O'Brien,Janet Gaynor,Margaret Livingston,,
"https://m.media-amazon.com/images/M/MV5BYmRiMDFlYjYtOTMwYy00OGY2LWE0Y2QtYzQxOGNhZmUwNTIxXkEyXkFqcGdeQXVyNzkwMjQ5NzM@._V1_UX67_CR0,0,67,98_AL_.jpg",The General,1926,"Action, Adventure, Comedy","When Union spies steal an engineer's beloved locomotive, he pursues it single-handedly and straight through enemy lines.",Clyde Bruckman,Buster Keaton,Buster Keaton,Marion Mack,,
"https://m.media-amazon.com/images/M/MV5BNWJiNGJiMTEtMGM3OC00ZWNlLTgwZTgtMzdhNTRiZjk5MTQ1XkEyXkFqcGdeQXVyMTMxODk2OTU@._V1_UY98_CR1,0,67,98_AL_.jpg",Das Cabinet des Dr. Caligari,1920,"Fantasy, Horror, Mystery","Hypnotist Dr. Caligari uses a somnambulist, Cesare, to commit murders.",Robert Wiene,Werner Krauss,Conrad Veidt,Friedrich Feher,,
"https://m.media-amazon.com/images/M/MV5BNjZlMDdmN2YtYThmZi00NGQzLTk0ZTQtNTUyZDFmODExOGNiXkEyXkFqcGdeQXVyODE5NzE3OTE@._V1_UY98_CR0,0,67,98_AL_.jpg",Badhaai ho,2018,"Comedy, Drama",A man is embarrassed when he finds out his mother is pregnant.,Amit Ravindernath Sharma,Ayushmann Khurrana,Neena Gupta,Gajraj Rao,,
"https://m.media-amazon.com/images/M/MV5BNjJkYTc5N2UtMGRlMC00M2FmLTk0ZWMtOTYxNDUwNjI2YzljXkEyXkFqcGdeQXVyNDg4NjY5OTQ@._V1_UX67_CR0,0,67,98_AL_.jpg",Togo,2019,"Adventure, Biography, Drama","The story of Togo, the sled dog who led the 1925 serum run yet was considered by most to be too small and weak to lead such an intense race.",Ericson Core,Willem Dafoe,Julianne Nicholson,Christopher Heyerdahl,,
"https://m.media-amazon.com/images/M/MV5BMGE1ZTkyOTMtMTdiZS00YzI2LTlmYWQtOTE5YWY0NWVlNjlmXkEyXkFqcGdeQXVyNjQ3ODkxMjE@._V1_UY98_CR0,0,67,98_AL_.jpg",Airlift,2016,"Drama, History","When Iraq invades Kuwait in August 1990, a callous Indian businessman becomes the spokesperson for more than 170,000 stranded countrymen.",Raja Menon,Akshay Kumar,Nimrat Kaur,Kumud Mishra,,
"https://m.media-amazon.com/images/M/MV5BMjE1NjQ5ODc2NV5BMl5BanBnXkFtZTgwOTM5ODIxNjE@._V1_UY98_CR0,0,67,98_AL_.jpg",Bajrangi Bhaijaan,2015,"Action, Adventure, Comedy",An Indian man with a magnanimous heart takes a young mute Pakistani girl back to her homeland to reunite her with her family.,Kabir Khan,Salman Khan,Harshaali Malhotra,Nawazuddin Siddiqui,,
"https://m.media-amazon.com/images/M/MV5BYTdhNjBjZDctYTlkYy00ZGIxLWFjYTktODk5ZjNlMzI4NjI3XkEyXkFqcGdeQXVyMjY1MjkzMjE@._V1_UY98_CR0,0,67,98_AL_.jpg",Baby,2015,"Action, Crime, Thriller","An elite counter-intelligence unit learns of a plot, masterminded by a maniacal madman. With the clock ticking, it's up to them to track the terrorists' international tentacles and prevent them from striking at the heart of India.",Neeraj Pandey,Akshay Kumar,Danny Denzongpa,Rana Daggubati,,
